Arxiv ID, Title, Authors, Type"
1404.7526, "The Universal Relation of Galactic Chemical Evolution: The Origin of the Mass-Metallicity Relation", Zahid et al., RES
1404.7735, "Validation of Bayesian posterior distributions using a multidimensional Kolmogorov--Smirnov test", Harrison et al., RES
1404.7546, "What could we learn from a sharply falling positron fraction?", Delahaye et al., NEW
1405.0105, "Deriving accurate peculiar velocities (even at high redshift)", Davis and Scrimour, REF
1405.0011, "Frontier Fields: High-Redshift Predictions and Early Results", Coe et al., RES
