Arxiv ID, Title, Authors, Type 
 1506.08828, "Record-breaking compact stellar systems in the Sloan Digital Sky Survey", Sandoval et al., RES
1506.08196, "Stability of Gas Clouds in Galactic Nuclei: An Extended Virial Theorem", Chen et al., RES NEW
1506.08205, "The Spectroscopic Properties of Lyα-Emitters at z ≈ 2.7: Escaping Gas and Photons from Faint Galaxies", Trainor et al., RES 
1506.08201, "A High-Resolution Hubble Space Telescope Study of Lyman Continuum Leakers at z∼3", Mostardi et al., RES
1506.08846, "The Link Between the Formation Rates of Clusters and Stars in Galaxies", Chandar et al., RES